{
  "schema_version": 1,
  "descriptor_id": "nimiplatform.voicestudio@0.5.9",
  "publisher_submission": {
    "pull_number": 106,
    "path": "submissions/nimiplatform/nimiplatform.voicestudio/0.5.9.json",
    "head_sha": "1deebc8501644871630fc9d724c46d73b1bd2722"
  },
  "admission": {
    "ordinary_release_proof": true,
    "trust_tier": "community",
    "build_assurance": "developer-attested",
    "dependency_assurance": {
      "lockfile_reviewed": true,
      "sbom_ref": null
    },
    "review": {
      "decision": "approved",
      "adjudicator_login": "snowzane",
      "adjudicator_actor_id": 1681360,
      "reason_code": "user-authorized-admission-with-recorded-limits",
      "decided_at": "2026-10-14T15:30:46.243Z"
    }
  },
  "candidate": {
    "app_id": "nimiplatform.voicestudio",
    "display_name": "VoiceStudio",
    "version": "0.5.9",
    "publisher": {
      "github_namespace": "nimiplatform",
      "namespace_kind": "organization",
      "assurance": "pseudonymous",
      "verified_domain_ref": null,
      "kyc_ref": null
    },
    "source": {
      "repository": "https://github.com/nimiplatform/VoiceStudio",
      "license": {
        "spdx_expression": "AGPL-3.0-only",
        "files": [
          {
            "path": "LICENSE",
            "sha256": "0d96a4ff68ad6d4b6f1f30f713b18d5184912ba8dd389f86aa7710db079abcb0"
          }
        ]
      }
    },
    "release": {
      "tag": "v0.5.9",
      "tag_protection_ref": "https://api.github.com/repos/nimiplatform/VoiceStudio/rulesets/25062459",
      "commit_sha": "eb0c55dcb64d5e614a9bb0af1a05af804c997151",
      "release_id": 412522139,
      "release_url": "https://github.com/nimiplatform/VoiceStudio/releases/tag/v0.5.9",
      "release_notes_url": "https://github.com/nimiplatform/VoiceStudio/releases/tag/v0.5.9",
      "immutable": true,
      "prerelease": false
    },
    "aggregate": {
      "asset_id": 639834740,
      "asset_name": "nimiplatform.voicestudio-0.5.9.candidate.json",
      "asset_url": "https://github.com/nimiplatform/VoiceStudio/releases/download/v0.5.9/nimiplatform.voicestudio-0.5.9.candidate.json",
      "size": 1078,
      "sha256": "a6a96a8bb7129ec67ba56c2f232fa8fbbfcf59c0c7c3f72ab03f8ab3978d9b73"
    },
    "package": {
      "kind": "nimiapp",
      "runtime_kind": "native",
      "registration_mode": "app-managed",
      "sandbox_ref": "ordinary-user-process-no-sandbox"
    },
    "app_access": [
      "runtime.consume"
    ],
    "capability_contract_refs": [
      "audio.synthesize",
      "audio.transcribe",
      "voice.create",
      "text.generate",
      "audio.separate"
    ],
    "required_standardized_feature_refs": [],
    "storage_policy": {
      "kind": "app-owned-os-storage",
      "os_storage_disclosure": [
        {
          "expected_size_band": "Varies with imported and generated media",
          "path_pattern": "%APPDATA%/OmniVoice",
          "purpose": "VoiceStudio voices, media, projects and business settings"
        }
      ]
    },
    "update_channel": "stable",
    "rollback_marker": "none",
    "support": {
      "diagnostics_bundle_fields": [
        "app_version",
        "runtime_status"
      ],
      "redaction_rules": [
        "credentials"
      ],
      "issue_categories": [
        "startup",
        "runtime"
      ],
      "escalation_url": "https://github.com/nimiplatform/VoiceStudio/issues",
      "kill_switch_visibility": "visible",
      "recovery_instructions": "Restart the App from Nimi. If the problem persists, reinstall the current admitted release."
    },
    "targets": [
      {
        "target_id": "windows-x86_64",
        "os": "windows",
        "arch": "x86_64",
        "asset_id": 639833100,
        "asset_name": "nimiplatform.voicestudio-0.5.9-windows-x86_64.nimiapp",
        "asset_url": "https://github.com/nimiplatform/VoiceStudio/releases/download/v0.5.9/nimiplatform.voicestudio-0.5.9-windows-x86_64.nimiapp",
        "size": 1026108405,
        "sha256": "37da7f8a9798c4d6f7c56ead55890e0cf3307ddf3e5762ed7cdd03039f41ff59",
        "app_info": {
          "asset_id": 639834665,
          "asset_name": "nimiplatform.voicestudio-0.5.9-windows-x86_64.app-info.json",
          "asset_url": "https://github.com/nimiplatform/VoiceStudio/releases/download/v0.5.9/nimiplatform.voicestudio-0.5.9-windows-x86_64.app-info.json",
          "size": 92836,
          "sha256": "e07120dddc431fd1aed28ce896a0464512a6ce8f6907e500d668ffc0f6adbfdb"
        },
        "runtime_entry": "payload/voicestudio-shell.exe",
        "provenance_attestation_refs": [
          "https://api.github.com/repos/nimiplatform/VoiceStudio/attestations/sha256:37da7f8a9798c4d6f7c56ead55890e0cf3307ddf3e5762ed7cdd03039f41ff59"
        ],
        "execution_profile_ref": "windows-user-mode-as-invoker-v1",
        "native_trust": {
          "signing_subject": null,
          "observed_subject": null,
          "entitlements_ref": null,
          "windows_code_signing": "unsigned",
          "macos_notarization": "not-applicable",
          "macos_developer_id_subject": null
        }
      }
    ],
    "safety_profile": {
      "ai": {
        "direct_interaction": true,
        "interaction_notice": "absent",
        "outputs": [
          {
            "export_visible_marking": "absent",
            "exposure": "exportable",
            "in_product_notice": "absent",
            "machine_readable_marking": "absent",
            "modality": "text",
            "publication_control": "not-applicable"
          },
          {
            "export_visible_marking": "absent",
            "exposure": "exportable",
            "in_product_notice": "absent",
            "machine_readable_marking": "absent",
            "modality": "audio",
            "publication_control": "not-applicable"
          },
          {
            "export_visible_marking": "absent",
            "exposure": "exportable",
            "in_product_notice": "absent",
            "machine_readable_marking": "absent",
            "modality": "video",
            "publication_control": "not-applicable"
          }
        ],
        "risk_features": [
          "realistic-voice-replication"
        ],
        "subject_notice": "not-applicable"
      },
      "content_descriptors": [],
      "data_practices": {
        "commercial_features": [],
        "publisher_direct_external_network": true,
        "sensitive_data_categories": [],
        "telemetry": [
          "usage-analytics"
        ],
        "third_party_account": "none",
        "user_content_sharing": "none"
      },
      "high_impact_decision_uses": [],
      "intended_audience": "general"
    }
  }
}
