{
  "schema_version": 1,
  "descriptor_id": "nimi.shijing@0.1.5",
  "publisher_submission": {
    "pull_number": 20,
    "path": "submissions/nimiplatform/nimi.shijing/0.1.5.json",
    "head_sha": "9ab8535035b451f4d9305c2c668af6d2dd5f437e"
  },
  "admission": {
    "ordinary_release_proof": true,
    "trust_tier": "community",
    "build_assurance": "developer-attested",
    "dependency_assurance": {
      "lockfile_reviewed": true,
      "sbom_ref": null
    },
    "review": {
      "decision": "approved",
      "adjudicator_login": "snowzane",
      "adjudicator_actor_id": 1681360,
      "reason_code": "maintainer-confirmed-admission",
      "decided_at": "2026-09-10T06:43:51.000Z"
    }
  },
  "candidate": {
    "app_id": "nimi.shijing",
    "display_name": "时镜 ShiJing",
    "version": "0.1.5",
    "publisher": {
      "github_namespace": "nimiplatform",
      "namespace_kind": "organization",
      "assurance": "pseudonymous",
      "verified_domain_ref": null,
      "kyc_ref": null
    },
    "source": {
      "repository": "https://github.com/nimiplatform/nimiapp-shijing",
      "license": {
        "spdx_expression": "MIT",
        "files": [
          {
            "path": "LICENSE",
            "sha256": "5830b56c92e055435c7eee5796fe5ba80645debe4d456dc070ef24f8697ab0c4"
          }
        ]
      }
    },
    "release": {
      "tag": "v0.1.5",
      "tag_protection_ref": "https://api.github.com/repos/nimiplatform/nimiapp-shijing/rulesets/22027407",
      "commit_sha": "70e65f9ac8ff87cdaa08f4907e8cf5b21a3eb310",
      "release_id": 386019043,
      "release_url": "https://github.com/nimiplatform/nimiapp-shijing/releases/tag/v0.1.5",
      "release_notes_url": "https://github.com/nimiplatform/nimiapp-shijing/releases/tag/v0.1.5",
      "immutable": true,
      "prerelease": false
    },
    "aggregate": {
      "asset_id": 554293584,
      "asset_name": "nimi.shijing-0.1.5.candidate.json",
      "asset_url": "https://github.com/nimiplatform/nimiapp-shijing/releases/download/v0.1.5/nimi.shijing-0.1.5.candidate.json",
      "size": 1558,
      "sha256": "d17daa09490559c34819fab135e91d622d0b7c56073e31cd39e62f7e85565709"
    },
    "package": {
      "kind": "nimiapp",
      "runtime_kind": "native",
      "registration_mode": "app-managed",
      "sandbox_ref": "https://github.com/nimiplatform/nimiapp-shijing/blob/70e65f9ac8ff87cdaa08f4907e8cf5b21a3eb310/src-electron/main.ts"
    },
    "app_access": [
      "runtime.consume"
    ],
    "capability_contract_refs": [
      "text.generate"
    ],
    "required_standardized_feature_refs": [],
    "storage_policy": {
      "kind": "nimi-mediated-default",
      "os_storage_disclosure": null
    },
    "update_channel": "stable",
    "rollback_marker": "none",
    "support": {
      "diagnostics_bundle_fields": [
        "app_version",
        "runtime_status"
      ],
      "redaction_rules": [
        "credentials",
        "personal_birth_data"
      ],
      "issue_categories": [
        "startup",
        "runtime",
        "calculation",
        "display"
      ],
      "escalation_url": "https://github.com/nimiplatform/nimiapp-shijing/issues",
      "kill_switch_visibility": "visible",
      "recovery_instructions": "Restart ShiJing from Nimi Desktop. If the problem persists, reinstall the current admitted release."
    },
    "targets": [
      {
        "target_id": "macos-aarch64",
        "os": "macos",
        "arch": "arm64",
        "asset_id": 554292472,
        "asset_name": "nimi.shijing-0.1.5-macos-aarch64.nimiapp",
        "asset_url": "https://github.com/nimiplatform/nimiapp-shijing/releases/download/v0.1.5/nimi.shijing-0.1.5-macos-aarch64.nimiapp",
        "size": 521668131,
        "sha256": "787682967cf3241e377b6d43535385f9516d3e7223d3366c1e34cb6ea2a5579c",
        "runtime_entry": "payload/nimiapp-shijing-shell.app/Contents/MacOS/nimiapp-shijing-shell",
        "provenance_attestation_refs": [
          "https://api.github.com/repos/nimiplatform/nimiapp-shijing/attestations/sha256:787682967cf3241e377b6d43535385f9516d3e7223d3366c1e34cb6ea2a5579c"
        ],
        "execution_profile_ref": "macos-user-mode-same-session-v1",
        "native_trust": {
          "signing_subject": null,
          "observed_subject": null,
          "entitlements_ref": null,
          "windows_code_signing": "not-applicable",
          "macos_notarization": "absent",
          "macos_developer_id_subject": null
        }
      },
      {
        "target_id": "windows-x86_64",
        "os": "windows",
        "arch": "x86_64",
        "asset_id": 554293031,
        "asset_name": "nimi.shijing-0.1.5-windows-x86_64.nimiapp",
        "asset_url": "https://github.com/nimiplatform/nimiapp-shijing/releases/download/v0.1.5/nimi.shijing-0.1.5-windows-x86_64.nimiapp",
        "size": 578699122,
        "sha256": "a81c76869d1d679999ce1c78da54ecc67492f76db93c138df0e7105290e3c4c0",
        "runtime_entry": "payload/nimiapp-shijing-shell.exe",
        "provenance_attestation_refs": [
          "https://api.github.com/repos/nimiplatform/nimiapp-shijing/attestations/sha256:a81c76869d1d679999ce1c78da54ecc67492f76db93c138df0e7105290e3c4c0"
        ],
        "execution_profile_ref": "windows-user-mode-as-invoker-v1",
        "native_trust": {
          "signing_subject": null,
          "observed_subject": null,
          "entitlements_ref": null,
          "windows_code_signing": "unsigned",
          "macos_notarization": "not-applicable",
          "macos_developer_id_subject": null
        }
      }
    ]
  }
}
