{
  "schema_version": 1,
  "descriptor_id": "nimi.inscape@0.1.1",
  "publisher_submission": {
    "pull_number": 18,
    "path": "submissions/nimiplatform/nimi.inscape/0.1.1.json",
    "head_sha": "8964401f81a9dc97c29bd3fb856311c3cc696309"
  },
  "admission": {
    "ordinary_release_proof": true,
    "trust_tier": "community",
    "build_assurance": "developer-attested",
    "dependency_assurance": {
      "lockfile_reviewed": true,
      "sbom_ref": null
    },
    "review": {
      "decision": "approved",
      "adjudicator_login": "snowzane",
      "adjudicator_actor_id": 1681360,
      "reason_code": "maintainer-confirmed-admission",
      "decided_at": "2026-09-10T06:43:51.000Z"
    }
  },
  "candidate": {
    "app_id": "nimi.inscape",
    "display_name": "Inscape",
    "version": "0.1.1",
    "publisher": {
      "github_namespace": "nimiplatform",
      "namespace_kind": "organization",
      "assurance": "pseudonymous",
      "verified_domain_ref": null,
      "kyc_ref": null
    },
    "source": {
      "repository": "https://github.com/nimiplatform/nimiapp-inscape",
      "license": {
        "spdx_expression": "MIT",
        "files": [
          {
            "path": "LICENSE",
            "sha256": "b5023f8aa1b0ac908b2a8d50fc7f98cc60a999679f4fb18b53758ee9a35605fc"
          }
        ]
      }
    },
    "release": {
      "tag": "v0.1.1",
      "tag_protection_ref": "https://api.github.com/repos/nimiplatform/nimiapp-inscape/rulesets/22613684",
      "commit_sha": "53a7a77ae5595d9e4c6260842b6f613504e3c3e0",
      "release_id": 386018996,
      "release_url": "https://github.com/nimiplatform/nimiapp-inscape/releases/tag/v0.1.1",
      "release_notes_url": "https://github.com/nimiplatform/nimiapp-inscape/releases/tag/v0.1.1",
      "immutable": true,
      "prerelease": false
    },
    "aggregate": {
      "asset_id": 554293038,
      "asset_name": "nimi.inscape-0.1.1.candidate.json",
      "asset_url": "https://github.com/nimiplatform/nimiapp-inscape/releases/download/v0.1.1/nimi.inscape-0.1.1.candidate.json",
      "size": 1558,
      "sha256": "911de88dc7d6c9623d71239f238d172dc2ab0fc1832d013c4468ea881709a3e7"
    },
    "package": {
      "kind": "nimiapp",
      "runtime_kind": "native",
      "registration_mode": "app-managed",
      "sandbox_ref": "https://github.com/nimiplatform/nimiapp-inscape/blob/53a7a77ae5595d9e4c6260842b6f613504e3c3e0/src-electron/main.ts"
    },
    "app_access": [
      "runtime.consume"
    ],
    "capability_contract_refs": [
      "text.generate"
    ],
    "required_standardized_feature_refs": [],
    "storage_policy": {
      "kind": "app-owned-os-storage",
      "os_storage_disclosure": [
        {
          "path_pattern": "<Electron userData>/inscape.db",
          "purpose": "Local SQLite storage for adult attestation, profiles, observations and reflections. Retained after Nimi uninstall; cleared from Inscape settings.",
          "expected_size_band": "Starts at a few KiB and grows with saved records; no App-enforced storage cap."
        }
      ]
    },
    "update_channel": "stable",
    "rollback_marker": "none",
    "support": {
      "diagnostics_bundle_fields": [
        "app_version",
        "runtime_status"
      ],
      "redaction_rules": [
        "credentials"
      ],
      "issue_categories": [
        "startup",
        "runtime"
      ],
      "escalation_url": "https://github.com/nimiplatform/nimiapp-inscape/issues",
      "kill_switch_visibility": "visible",
      "recovery_instructions": "Restart the App from Nimi. If the problem persists, reinstall the current admitted release."
    },
    "targets": [
      {
        "target_id": "macos-aarch64",
        "os": "macos",
        "arch": "arm64",
        "asset_id": 554292197,
        "asset_name": "nimi.inscape-0.1.1-macos-aarch64.nimiapp",
        "asset_url": "https://github.com/nimiplatform/nimiapp-inscape/releases/download/v0.1.1/nimi.inscape-0.1.1-macos-aarch64.nimiapp",
        "size": 539356089,
        "sha256": "162f80cc641773a3edb1c7d2568b345a2002e87f7f828abf8a3e45a3341bb6a6",
        "runtime_entry": "payload/nimiapp-inscape-shell.app/Contents/MacOS/nimiapp-inscape-shell",
        "provenance_attestation_refs": [
          "https://api.github.com/repos/nimiplatform/nimiapp-inscape/attestations/sha256:162f80cc641773a3edb1c7d2568b345a2002e87f7f828abf8a3e45a3341bb6a6"
        ],
        "execution_profile_ref": "macos-user-mode-same-session-v1",
        "native_trust": {
          "signing_subject": null,
          "observed_subject": null,
          "entitlements_ref": null,
          "windows_code_signing": "not-applicable",
          "macos_notarization": "absent",
          "macos_developer_id_subject": null
        }
      },
      {
        "target_id": "windows-x86_64",
        "os": "windows",
        "arch": "x86_64",
        "asset_id": 554292654,
        "asset_name": "nimi.inscape-0.1.1-windows-x86_64.nimiapp",
        "asset_url": "https://github.com/nimiplatform/nimiapp-inscape/releases/download/v0.1.1/nimi.inscape-0.1.1-windows-x86_64.nimiapp",
        "size": 586324106,
        "sha256": "f00942759ba533b3f86a7eaecd8b2886754f5cbc5244d91562e2b03b46e18abc",
        "runtime_entry": "payload/nimiapp-inscape-shell.exe",
        "provenance_attestation_refs": [
          "https://api.github.com/repos/nimiplatform/nimiapp-inscape/attestations/sha256:f00942759ba533b3f86a7eaecd8b2886754f5cbc5244d91562e2b03b46e18abc"
        ],
        "execution_profile_ref": "windows-user-mode-as-invoker-v1",
        "native_trust": {
          "signing_subject": null,
          "observed_subject": null,
          "entitlements_ref": null,
          "windows_code_signing": "unsigned",
          "macos_notarization": "not-applicable",
          "macos_developer_id_subject": null
        }
      }
    ]
  }
}
