{
  "schema_version": 1,
  "descriptor_id": "io.github.nimiplatform.presenton@0.9.11-beta.7",
  "publisher_submission": {
    "pull_number": 79,
    "path": "submissions/nimiplatform/io.github.nimiplatform.presenton/0.9.11-beta.7.json",
    "head_sha": "f32416803039862c88a7d727400c89a25fe1d2d2"
  },
  "admission": {
    "ordinary_release_proof": true,
    "trust_tier": "community",
    "build_assurance": "developer-attested",
    "dependency_assurance": {
      "lockfile_reviewed": true,
      "sbom_ref": null
    },
    "review": {
      "decision": "approved",
      "adjudicator_login": "snowzane",
      "adjudicator_actor_id": 1681360,
      "reason_code": "user-authorized-version-update",
      "decided_at": "2026-10-12T13:43:45.981132Z"
    }
  },
  "candidate": {
    "app_id": "io.github.nimiplatform.presenton",
    "display_name": "Presenton",
    "version": "0.9.11-beta.7",
    "publisher": {
      "github_namespace": "nimiplatform",
      "namespace_kind": "organization",
      "assurance": "pseudonymous",
      "verified_domain_ref": null,
      "kyc_ref": null
    },
    "source": {
      "repository": "https://github.com/nimiplatform/presenton",
      "license": {
        "spdx_expression": "Apache-2.0",
        "files": [
          {
            "path": "LICENSE",
            "sha256": "23d6fd64bfcbd46b331098ed89454717fd1719faccbf632f8234b962aa43ed1a"
          }
        ]
      }
    },
    "release": {
      "tag": "v0.9.11-beta.7",
      "tag_protection_ref": "https://api.github.com/repos/nimiplatform/presenton/rulesets/24907490",
      "commit_sha": "f7a571a185ea616e1f8d9050773cea2879e6ead2",
      "release_id": 410635360,
      "release_url": "https://github.com/nimiplatform/presenton/releases/tag/v0.9.11-beta.7",
      "release_notes_url": "https://github.com/nimiplatform/presenton/releases/tag/v0.9.11-beta.7",
      "immutable": true,
      "prerelease": false
    },
    "aggregate": {
      "asset_id": 633888338,
      "asset_name": "io.github.nimiplatform.presenton-0.9.11-beta.7.candidate.json",
      "asset_url": "https://github.com/nimiplatform/presenton/releases/download/v0.9.11-beta.7/io.github.nimiplatform.presenton-0.9.11-beta.7.candidate.json",
      "size": 1162,
      "sha256": "a608f41669dab88ff3dc8d070c0e8e5cd3bd1a723e0f039baa93b3d7c5a400b7"
    },
    "package": {
      "kind": "nimiapp",
      "runtime_kind": "native",
      "registration_mode": "app-managed",
      "sandbox_ref": "ordinary-user-process-no-sandbox"
    },
    "app_access": [
      "runtime.consume"
    ],
    "capability_contract_refs": [
      "text.generate",
      "image.generate",
      "text.embed"
    ],
    "required_standardized_feature_refs": [],
    "storage_policy": {
      "kind": "app-owned-os-storage",
      "os_storage_disclosure": [
        {
          "expected_size_band": "10 MB\u201310 GB depending on imported media",
          "path_pattern": "~/Library/Application Support/Presenton Nimi/workspaces/",
          "purpose": "Presentation databases, templates, uploaded documents, generated images and document retrieval caches, partitioned by the Nimi-managed App workspace identifier"
        },
        {
          "expected_size_band": "Up to hundreds of MB per presentation",
          "path_pattern": "User-selected download destinations",
          "purpose": "Exported PDF and PPTX presentations"
        }
      ]
    },
    "update_channel": "beta",
    "rollback_marker": "none",
    "support": {
      "diagnostics_bundle_fields": [
        "app_version",
        "runtime_status",
        "failed_operation",
        "error_message"
      ],
      "redaction_rules": [
        "credentials",
        "session_tokens",
        "private_documents",
        "private_prompts_and_queries"
      ],
      "issue_categories": [
        "startup",
        "ai",
        "presentations",
        "images",
        "export",
        "storage"
      ],
      "escalation_url": "https://github.com/nimiplatform/presenton/issues",
      "kill_switch_visibility": "visible",
      "recovery_instructions": "Restart the App from Nimi after checking the reported error and model configuration. Interrupted work is not evidence of completion."
    },
    "targets": [
      {
        "target_id": "macos-aarch64",
        "os": "macos",
        "arch": "arm64",
        "asset_id": 633885556,
        "asset_name": "io.github.nimiplatform.presenton-0.9.11-beta.7-macos-aarch64.nimiapp",
        "asset_url": "https://github.com/nimiplatform/presenton/releases/download/v0.9.11-beta.7/io.github.nimiplatform.presenton-0.9.11-beta.7-macos-aarch64.nimiapp",
        "size": 1833628786,
        "sha256": "b6c1caf2ee923ec4e878f93e870fc3e0de33503c5b34d2f1f9970ab52410b06a",
        "app_info": {
          "asset_id": 633888278,
          "asset_name": "io.github.nimiplatform.presenton-0.9.11-beta.7-macos-aarch64.app-info.json",
          "asset_url": "https://github.com/nimiplatform/presenton/releases/download/v0.9.11-beta.7/io.github.nimiplatform.presenton-0.9.11-beta.7-macos-aarch64.app-info.json",
          "size": 97249,
          "sha256": "3df1c86a870714f7c1cde5d91742d8a959592fec01c19fc774311761a894a5b6"
        },
        "runtime_entry": "payload/presenton-shell.app/Contents/MacOS/presenton-shell",
        "provenance_attestation_refs": [
          "https://api.github.com/repos/nimiplatform/presenton/attestations/sha256:b6c1caf2ee923ec4e878f93e870fc3e0de33503c5b34d2f1f9970ab52410b06a"
        ],
        "execution_profile_ref": "macos-user-mode-same-session-v1",
        "native_trust": {
          "signing_subject": null,
          "observed_subject": null,
          "entitlements_ref": null,
          "windows_code_signing": "not-applicable",
          "macos_notarization": "absent",
          "macos_developer_id_subject": null
        }
      }
    ]
  }
}
