{
  "schema_version": 1,
  "descriptor_id": "nimiplatform.vane@0.1.6",
  "publisher_submission": {
    "pull_number": 73,
    "path": "submissions/nimiplatform/nimiplatform.vane/0.1.6.json",
    "head_sha": "55c94d06423fdf93b613768c03f665647592dbaa"
  },
  "admission": {
    "ordinary_release_proof": true,
    "trust_tier": "community",
    "build_assurance": "developer-attested",
    "dependency_assurance": {
      "lockfile_reviewed": true,
      "sbom_ref": null
    },
    "review": {
      "decision": "approved",
      "adjudicator_login": "snowzane",
      "adjudicator_actor_id": 1681360,
      "reason_code": "user-authorized-version-update",
      "decided_at": "2026-10-12T11:23:41.922306Z"
    }
  },
  "candidate": {
    "app_id": "nimiplatform.vane",
    "display_name": "Vane",
    "version": "0.1.6",
    "publisher": {
      "github_namespace": "nimiplatform",
      "namespace_kind": "organization",
      "assurance": "pseudonymous",
      "verified_domain_ref": null,
      "kyc_ref": null
    },
    "source": {
      "repository": "https://github.com/nimiplatform/Vane",
      "license": {
        "spdx_expression": "MIT",
        "files": [
          {
            "path": "LICENSE",
            "sha256": "d76e1037fdcc8ab04db9e8ffcfe6104effc513cd7530401f8f45e98941822ba6"
          }
        ]
      }
    },
    "release": {
      "tag": "v0.1.6",
      "tag_protection_ref": "https://api.github.com/repos/nimiplatform/Vane/rulesets/23202803",
      "commit_sha": "c785237d8aad8c9b4fcd5b0df0fff0cce65b030d",
      "release_id": 410515321,
      "release_url": "https://github.com/nimiplatform/Vane/releases/tag/v0.1.6",
      "release_notes_url": "https://github.com/nimiplatform/Vane/releases/tag/v0.1.6",
      "immutable": true,
      "prerelease": false
    },
    "aggregate": {
      "asset_id": 633544244,
      "asset_name": "nimiplatform.vane-0.1.6.candidate.json",
      "asset_url": "https://github.com/nimiplatform/Vane/releases/download/v0.1.6/nimiplatform.vane-0.1.6.candidate.json",
      "size": 1979,
      "sha256": "82a42f9458b7ab14c40cd4c1f1ad579c92a9f7b34a04b421c2f18d10f8c76186"
    },
    "package": {
      "kind": "nimiapp",
      "runtime_kind": "native",
      "registration_mode": "app-managed",
      "sandbox_ref": "ordinary-user-process-no-sandbox"
    },
    "app_access": [
      "runtime.consume"
    ],
    "capability_contract_refs": [
      "text.generate",
      "text.embed"
    ],
    "required_standardized_feature_refs": [],
    "storage_policy": {
      "kind": "nimi-mediated-default",
      "os_storage_disclosure": null
    },
    "update_channel": "stable",
    "rollback_marker": "none",
    "support": {
      "diagnostics_bundle_fields": [
        "app_version",
        "runtime_status",
        "failed_operation",
        "error_message"
      ],
      "redaction_rules": [
        "credentials",
        "session_tokens",
        "private_documents",
        "private_prompts_and_queries"
      ],
      "issue_categories": [
        "startup",
        "ai",
        "search",
        "documents",
        "storage"
      ],
      "escalation_url": "https://github.com/nimiplatform/Vane/issues",
      "kill_switch_visibility": "visible",
      "recovery_instructions": "Restart the App from Nimi after checking the reported error and model configuration. Interrupted work is not evidence of completion."
    },
    "targets": [
      {
        "target_id": "macos-aarch64",
        "os": "macos",
        "arch": "arm64",
        "asset_id": 633541633,
        "asset_name": "nimiplatform.vane-0.1.6-macos-aarch64.nimiapp",
        "asset_url": "https://github.com/nimiplatform/Vane/releases/download/v0.1.6/nimiplatform.vane-0.1.6-macos-aarch64.nimiapp",
        "size": 824065784,
        "sha256": "009469d41aab95e0c734fe46b118cec9ec6c7a0d16c56bde4b14dc822d687abf",
        "app_info": {
          "asset_id": 633544160,
          "asset_name": "nimiplatform.vane-0.1.6-macos-aarch64.app-info.json",
          "asset_url": "https://github.com/nimiplatform/Vane/releases/download/v0.1.6/nimiplatform.vane-0.1.6-macos-aarch64.app-info.json",
          "size": 58164,
          "sha256": "7201819f3acef5d2adf3b1cd7158f2754489fb9073b7a608a6d9334271d1cba3"
        },
        "runtime_entry": "payload/vane-shell.app/Contents/MacOS/vane-shell",
        "provenance_attestation_refs": [
          "https://api.github.com/repos/nimiplatform/Vane/attestations/sha256:009469d41aab95e0c734fe46b118cec9ec6c7a0d16c56bde4b14dc822d687abf"
        ],
        "execution_profile_ref": "macos-user-mode-same-session-v1",
        "native_trust": {
          "signing_subject": null,
          "observed_subject": null,
          "entitlements_ref": null,
          "windows_code_signing": "not-applicable",
          "macos_notarization": "absent",
          "macos_developer_id_subject": null
        }
      },
      {
        "target_id": "windows-x86_64",
        "os": "windows",
        "arch": "x86_64",
        "asset_id": 633542831,
        "asset_name": "nimiplatform.vane-0.1.6-windows-x86_64.nimiapp",
        "asset_url": "https://github.com/nimiplatform/Vane/releases/download/v0.1.6/nimiplatform.vane-0.1.6-windows-x86_64.nimiapp",
        "size": 909024178,
        "sha256": "8bcfac091dcba13d2114c6aac7515eac269e31e57012c8e1592adc61878907e8",
        "app_info": {
          "asset_id": 633544208,
          "asset_name": "nimiplatform.vane-0.1.6-windows-x86_64.app-info.json",
          "asset_url": "https://github.com/nimiplatform/Vane/releases/download/v0.1.6/nimiplatform.vane-0.1.6-windows-x86_64.app-info.json",
          "size": 58525,
          "sha256": "a2c22397f049874ac0f47c45068fe373913224d86d45f15977a065d6a548f436"
        },
        "runtime_entry": "payload/vane-shell.exe",
        "provenance_attestation_refs": [
          "https://api.github.com/repos/nimiplatform/Vane/attestations/sha256:8bcfac091dcba13d2114c6aac7515eac269e31e57012c8e1592adc61878907e8"
        ],
        "execution_profile_ref": "windows-user-mode-as-invoker-v1",
        "native_trust": {
          "signing_subject": null,
          "observed_subject": null,
          "entitlements_ref": null,
          "windows_code_signing": "unsigned",
          "macos_notarization": "not-applicable",
          "macos_developer_id_subject": null
        }
      }
    ],
    "safety_profile": {
      "ai": {
        "direct_interaction": true,
        "interaction_notice": "absent",
        "outputs": [
          {
            "export_visible_marking": "absent",
            "exposure": "exportable",
            "in_product_notice": "absent",
            "machine_readable_marking": "absent",
            "modality": "text",
            "publication_control": "not-applicable"
          },
          {
            "export_visible_marking": "not-applicable",
            "exposure": "in-app-only",
            "in_product_notice": "absent",
            "machine_readable_marking": "absent",
            "modality": "audio",
            "publication_control": "not-applicable"
          }
        ],
        "risk_features": [],
        "subject_notice": "not-applicable"
      },
      "content_descriptors": [
        "unmoderated-shared-content"
      ],
      "data_practices": {
        "commercial_features": [],
        "publisher_direct_external_network": true,
        "sensitive_data_categories": [
          "precise-location"
        ],
        "telemetry": [],
        "third_party_account": "none",
        "user_content_sharing": "none"
      },
      "high_impact_decision_uses": [],
      "intended_audience": "general"
    }
  }
}
